Musica,Letra
Somos Quem Podemos Ser,"[<p>Um dia me disseram<br/>Que as nuvens não eram de algodão<br/>Um dia me disseram<br/>Que os ventos às vezes erram a direção</p>, <p>E tudo ficou tão claro<br/>Um intervalo na escuridão<br/>Uma estrela de brilho raro<br/>Um disparo para um coração</p>, <p>A vida imita o vídeo<br/>Garotos inventam um novo inglês<br/>Vivendo num país sedento<br/>Um momento de embriaguez</p>, <p>Somos quem podemos ser<br/>Sonhos que podemos ter</p>, <p>Um dia me disseram<br/>Quem eram os donos da situação<br/>Sem querer eles me deram<br/>As chaves que abrem essa prisão</p>, <p>E tudo ficou tão claro<br/>O que era raro ficou comum<br/>Como um dia depois do outro<br/>Como um dia, um dia comum</p>, <p>A vida imita o vídeo<br/>Garotos inventam um novo inglês<br/>Vivendo num país sedento<br/>Um momento de embriaguez</p>, <p>Somos quem podemos ser<br/>Sonhos que podemos ter</p>, <p>Um dia me disseram<br/>Que as nuvens não eram de algodão<br/>Sem querer eles me deram<br/>As chaves que abrem essa prisão</p>, <p>Quem ocupa o trono tem culpa<br/>Quem oculta o crime também<br/>Quem duvida da vida tem culpa<br/>Quem evita a dúvida também tem</p>, <p>Somos quem podemos ser<br/>Sonhos que podemos ter</p>]"
Toda Forma de Poder,"[<p>Eu presto atenção no que eles dizem<br/>Mas eles não dizem nada (yeah, yeah)<br/>Fidel e Pinochet tiram sarro de você<br/>Que não faz nada (yeah, yeah)<br/>E eu começo a achar normal que algum boçal<br/>Atire bombas na embaixada (yeah, yeah)<br/>(Uou, uou)</p>, <p>Se tudo passa, talvez você passe por aqui<br/>E me faça esquecer tudo que eu vi<br/>Se tudo passa, talvez você passe por aqui<br/>E me faça esquecer</p>, <p>Toda forma de poder<br/>É uma forma de morrer por nada (yeah, yeah)<br/>Toda forma de conduta<br/>Se transforma numa luta armada (uou, uou)<br/>A história se repete<br/>Mas a força deixa a história mal contada</p>, <p>Tada, tada, tada, tada<br/>Tada, tada, tada, tada<br/>Tada, tada, tada, oh</p>, <p>Se tudo passa, talvez você passe por aqui<br/>E me faça esquecer tudo que eu vi<br/>Se tudo passa, talvez você passe por aqui<br/>E me faça esquecer</p>, <p>E o fascismo é fascinante<br/>E deixa gente ignorante fascinada (uou, oh)<br/>É tão fácil ir adiante e se esquecer<br/>Que a coisa toda tá errada (uou, yeah)<br/>Eu presto atenção no que eles dizem<br/>Mas eles não dizem nada</p>, <p>Nada, nada, nada, nada<br/>Nada, nada, nada, nada<br/>Nada, nada, nada, não</p>, <p>Se tudo passa, talvez você passe por aqui<br/>E me faça esquecer tudo que eu vi<br/>Se tudo passa, talvez você passe por aqui<br/>E me faça esquecer</p>, <p>Se tudo passa, talvez você passe por aqui<br/>E me faça esquecer tudo que eu vi<br/>Se tudo passa, talvez você passe por aqui<br/>E me faça esquecer (oh)</p>, <p>Yeah, oh</p>]"
Era Um Garoto Que Como Eu Amava Os Beatles e Os Rolling Stones,"[<p>Era um garoto que como eu<br/>Amava os Beatles e os Rolling Stones<br/>Girava o mundo sempre a cantar<br/>As coisas lindas da América</p>, <p>Não era belo, mas mesmo assim<br/>Havia mil garotas a fim<br/>Cantava Help and Ticket to Ride<br/>Oh Lady Jane e Yesterday</p>, <p>Cantava viva à liberdade<br/>Mas uma carta, sem esperar<br/>Da sua guitarra o separou<br/>Fora chamado na América</p>, <p>Stop! Com Rolling Stones<br/>Stop! Com Beatles songs<br/>Mandado foi ao Vietnã<br/>Lutar com Vietcongs</p>, <p>Ratá-tá tá tá, tatá-rá tá tá<br/>Tatá-tá tá tá, tatá-rá tá tá<br/>Tatá-tá tá tá, tatá-rá tá tá<br/>Tatá-tá tá tá</p>, <p>Era um garoto que como eu<br/>Amava os Beatles e os Rolling Stones<br/>Girava o mundo, mas acabou<br/>Fazendo a guerra no Vietnã</p>, <p>Cabelos longos não usa mais<br/>Não toca a sua guitarra, e sim<br/>Um instrumento que sempre dá<br/>A mesma nota, ra-tá-tá-tá</p>, <p>Não tem amigos, não vê garotas<br/>Só gente morta caindo ao chão<br/>Ao seu país não voltará<br/>Pois está morto no Vietnã</p>, <p>Stop! Com Rolling Stones<br/>Stop! Com Beatles songs<br/>No peito, um coração não há<br/>Mas duas medalhas sim</p>, <p>Ratá-tá tá tá, tatá-rá tá tá<br/>Tatá-tá tá tá, tatá-rá tá tá<br/>Tatá-tá tá tá, tatá-rá tá tá<br/>Tatá-tá tá tá</p>, <p>Ratá-tá tá tá, tatá-rá tá tá<br/>Tatá-tá tá tá, tatá-rá tá tá<br/>Tatá-tá tá tá, tatá-rá tá tá<br/>Tatá-tá tá tá</p>, <p>Ratá-tá tá tá, tatá-rá tá tá<br/>Tatá-tá tá tá, tatá-rá tá tá<br/>Tatá-tá tá tá, tatá-rá tá tá<br/>Tatá-tá tá tá</p>, <p>Ratá-tá tá tá, tatá-rá tá tá<br/>Tatá-tá tá tá, tatá-rá tá tá<br/>Tatá-tá tá tá, tatá-rá tá tá<br/>Ratá-tá tá tá<br/>Ratá-tá tá tá</p>]"
A Revolta Dos Dândis (Parte I),"[<p>Entre um rosto e um retrato, o real e o abstrato<br/>Entre a loucura e a lucidez<br/>Entre o uniforme e a nudez<br/>Entre o fim do mundo e o fim do mês<br/>Entre a verdade e o rock inglês<br/>Entre os outros e vocês</p>, <p>Eu me sinto um estrangeiro<br/>Passageiro de algum trem<br/>Que não passa por aqui<br/>Que não passa de ilusão</p>, <p>Entre mortos e feridos, entre gritos e gemidos<br/>(A mentira e a verdade, a solidão e a cidade)<br/>Entre um copo e outro da mesma bebida<br/>Entre tantos corpos com a mesma ferida</p>, <p>Eu me sinto um estrangeiro<br/>Passageiro de algum trem<br/>Que não passa por aqui<br/>Que não passa de ilusão</p>, <p>Entre americanos e soviéticos, gregos e troianos<br/>Entra ano e sai ano, sempre os mesmos planos<br/>Entre a minha boca e a tua, há tanto tempo, há tantos planos<br/>Mas eu nunca sei pra onde vamos</p>, <p>Eu me sinto um estrangeiro<br/>Passageiro de algum trem<br/>Que não passa por aqui<br/>Que não passa de ilusão</p>]"
Sopa de Letrinhas,"[<p>O nosso amor é nazi-fascista<br/>Você se esconde e eu sigo tua pista<br/>Eu fico sozinho mas eu fico em paz<br/>Eu volto pra casa você volta atrás</p>, <p>O nosso amor é medieval<br/>É como uma pedra em piso<br/>De catedral<br/>Ontem a noite eu tive um sonho<br/>Exótico<br/>Nós dois por aí transando sexo gótico<br/>Eu fico sozinho<br/>Teu beijo me arranha<br/>Um estranho no ninho<br/>Ninguém estranha</p>, <p>O nosso amor é uma abobrinha<br/>Eu escrevo o teu nome numa sopa<br/>De letrinhas<br/>Eu fico sonhando em ser astronauta<br/>Eu olho pra Lua, eu sinto tua falta</p>, <p>O nosso amor é pós-moderno<br/>Eu quero que você se aqueça nesse<br/>Inverno<br/>Eu tenho andado aéreo como tropas minhas<br/>No ataque<br/>Fim de noite fim do mundo lá no fundo<br/>Do conhaque<br/>Eu fico sozinho<br/>Teu beijo me arranha<br/>Um estranho no ninho<br/>Ninguém estranha</p>, <p>O nosso amor é nazi-fascista<br/>Eu tento fugir você me conquista<br/>Eu fico sozinho mas eu fico em paz<br/>Eu volto pra casa e você volta atrás<br/>Eu fico sozinho<br/>Teu beijo me arranha<br/>Um estranho no ninho</p>]"
Pra Ser Sincero,"[<p>Pra ser sincero<br/>Não espero de você<br/>Mais do que educação<br/>Beijos sem paixão<br/>Crime sem castigo<br/>Aperto de mãos<br/>Apenas bons amigos</p>, <p>Pra ser sincero<br/>Não espero que você<br/>Minta<br/>Não se sinta capaz<br/>De enganar<br/>Quem não engana<br/>A si mesmo</p>, <p>Nós dois temos<br/>Os mesmos defeitos<br/>Sabemos tudo<br/>A nosso respeito<br/>Somos suspeitos<br/>De um crime perfeito<br/>Mas crimes perfeitos<br/>Não deixam suspeitos</p>, <p>Pra ser sincero<br/>Não espero de você<br/>Mais do que educação<br/>Beijos sem paixão<br/>Crime sem castigo<br/>Aperto de mãos<br/>Apenas bons amigos</p>, <p>Pra ser sincero<br/>Não espero que você<br/>Me perdoe<br/>Por ter perdido a calma<br/>Por ter vendido a alma<br/>Ao diabo</p>, <p>Um dia desses<br/>Num desses<br/>Encontros casuais<br/>Talvez a gente<br/>Se encontre<br/>Talvez a gente<br/>Encontre explicação</p>, <p>Um dia desses<br/>Num desses<br/>Encontros casuais<br/>Talvez eu diga<br/>Minha amiga<br/>Pra ser sincero<br/>Prazer em vê-la<br/>Até mais</p>, <p>Nós dois temos<br/>Os mesmos defeitos<br/>Sabemos tudo<br/>A nosso respeito<br/>Somos suspeitos<br/>De um crime perfeito<br/>Mas crimes perfeitos<br/>Não deixam suspeitos</p>]"
Infinita Highway,"[<p>Você me faz correr demais<br/>Os riscos desta highway<br/>Você me faz correr atrás<br/>Do horizonte desta highway</p>, <p>Ninguém por perto, silêncio no deserto<br/>Deserta highway<br/>Estamos sós e nenhum de nós<br/>Sabe exatamente onde vai parar</p>, <p>Mas não precisamos saber pra onde vamos<br/>Nós só precisamos ir<br/>Não queremos ter o que não temos<br/>Nós só queremos viver</p>, <p>Sem motivos, nem objetivos<br/>Estamos vivos e isto é tudo<br/>É sobretudo a lei<br/>Da infinita highway</p>, <p>Quando eu vivia e morria na cidade<br/>Eu não tinha nada, nada a temer<br/>Mas eu tinha medo, medo desta estrada<br/>Olhe só! Veja você</p>, <p>Quando eu vivia e morria na cidade<br/>Eu tinha de tudo, tudo ao meu redor<br/>Mas tudo o que eu sentia era que algo me faltava<br/>E à noite eu acordava banhado em suor</p>, <p>Não queremos lembrar o que esquecemos<br/>Nós só queremos viver<br/>Não queremos aprender o que sabemos<br/>Não queremos nem saber</p>, <p>Sem motivos, nem objetivos<br/>Estamos vivos e é só<br/>Só obedecemos a lei<br/>Da infinita highway</p>, <p>Escute garota, o vento canta uma canção<br/>Dessas que a gente nunca canta sem razão<br/>Me diga, garota: Será a estrada uma prisão?<br/>Eu acho que sim, você finge que não</p>, <p>Mas nem por isso ficaremos parados<br/>Com a cabeça nas nuvens e os pés no chão<br/>Tudo bem, garota, não adianta mesmo ser livre<br/>Se tanta gente vive sem ter como viver</p>, <p>Estamos sós e nenhum de nós<br/>Sabe onde quer chegar<br/>Estamos vivos sem motivos<br/>Que motivos temos pra estar?</p>, <p>Atrás de palavras escondidas<br/>Nas entrelinhas do horizonte<br/>Dessa highway<br/>Silenciosa highway (highway)</p>, <p>Eu vejo um horizonte trêmulo<br/>Eu tenho os olhos úmidos<br/>Eu posso estar completamente enganado<br/>Eu posso estar correndo pro lado errado</p>, <p>Mas a dúvida é o preço da pureza<br/>E é inútil ter certeza<br/>Eu vejo as placas dizendo<br/>Não corra, não morra, não fume<br/>Eu vejo as placas cortando o horizonte<br/>Elas parecem facas de dois gumes</p>, <p>Minha vida é tão confusa quanto a América central<br/>Por isso não me acuse de ser irracional</p>, <p>Escute garota<br/>Façamos um trato<br/>Você desliga o telefone<br/>Se eu ficar muito abstrato</p>, <p>Eu posso ser um beatle<br/>Um beatnik ou um bitolado<br/>Mas eu não sou ator<br/>Eu não tô à toa do teu lado</p>, <p>Por isso, garota<br/>Façamos um pacto<br/>De não usar a highway<br/>Pra causar impacto</p>, <p>Cento e dez<br/>Cento e vinte<br/>Cento e sessenta<br/>Só pra ver até quando<br/>O motor aguenta</p>, <p>Na boca, em vez de um beijo<br/>Um chiclet de menta<br/>E a sombra do sorriso que eu deixei<br/>Numa das curvas da highway (highway)</p>, <p>Highway (highway)<br/>Infinita highway (highway)<br/>Highway (highway)<br/>Infinita highway (highway)</p>, <p>Highway (highway)<br/>Highway (highway)<br/>Highway (highway)</p>]"
O Papa É Pop,"[<p>Todo mundo tá relendo o que nunca foi lido<br/>Todo mundo tá comprando os mais vendidos<br/>É qualquer nota, qualquer notícia<br/>Páginas em branco, fotos coloridas<br/>Qualquer nova, qualquer notícia<br/>Qualquer coisa que se mova é um alvo<br/>E ninguém tá salvo</p>, <p>Todo mundo tá revendo o que nunca foi visto<br/>Tá na cara, tá na capa da revista<br/>Qualquer nota, uma nota preta<br/>Páginas em branco, fotos coloridas<br/>Qualquer rota (rotatividade)<br/>Qualquer coisa que se mova é um alvo<br/>E ninguém tá salvo</p>, <p>Um disparo<br/>Um estouro</p>, <p>O Papa é pop, o Papa é pop<br/>O pop não poupa ninguém<br/>O Papa levou um tiro à queima roupa<br/>O pop não poupa ninguém</p>, <p>(O presidente é pop, um indigente é pop)<br/>O Papa é pop, o Papa é pop<br/>(Nós somos pop também)<br/>O pop não poupa ninguém<br/>(A minha mente é pop, a tua mente é pop)<br/>O Papa levou um tiro à queima roupa<br/>(O pop não poupa ninguém)<br/>O pop não poupa ninguém</p>, <p>Uma palavra na tua camiseta<br/>O planeta na tua cama<br/>Uma palavra escrita a lápis<br/>Eternidades da semana</p>, <p>Qualquer nota, qualquer notícia<br/>Páginas em branco, fotos coloridas<br/>Qualquer coisa quase nova<br/>Qualquer coisa que se mova é um alvo<br/>E ninguém tá salvo</p>, <p>Um disparo<br/>Um estouro</p>, <p>O Papa é pop, o Papa é pop<br/>O pop não poupa ninguém<br/>O Papa levou um tiro à queima roupa<br/>O pop não poupa ninguém</p>, <p>(O presidente é pop, um indigente é pop)<br/>O Papa é pop, o Papa é pop<br/>(Nós somos pop também)<br/>O pop não poupa ninguém<br/>(Antigamente é pop, atualmente é pop)<br/>O Papa levou um tiro à queima roupa<br/>(O pop não poupa ninguém)<br/>O pop não poupa ninguém</p>, <p>Toda catedral é populista, é pop<br/>É macumba pra turista<br/>E afinal, o que é rock'n'roll?<br/>Os óculos do John ou o olhar do Paul?</p>, <p>O Papa é pop, o Papa é pop<br/>O pop não poupa ninguém<br/>O Papa levou um tiro à queima roupa<br/>O pop não poupa ninguém</p>, <p>O Papa é pop, o Papa é pop<br/>O pop não poupa ninguém<br/>O Papa levou um tiro à queima roupa<br/>O pop não poupa, o pop não poupa<br/>O pop não poupa ninguém</p>]"
Alívio Imediato,"[<p>O melhor esconderijo, a maior escuridão<br/>Já não servem de abrigo, já não dão proteção<br/>A Líbia é bombardeada, a libido e o vírus<br/>O poder, o pudor, os lábios e o batom</p>, <p>O melhor esconderijo, a maior escuridão<br/>Já não servem de abrigo, já não dão proteção<br/>A Líbia é bombardeada, a libido e o vírus<br/>O poder, o pudor, os lábios e o batom</p>, <p>Que a chuva caia como uma luva<br/>Um dilúvio, um delírio<br/>Que a chuva traga<br/>Alívio imediato</p>, <p>Que a noite caia<br/>De repente caia<br/>Tão demente quanto um raio<br/>Que a noite traga<br/>Alívio imediato</p>, <p>Há espaço pra todos, há um imenso vazio<br/>Nesse espelho quebrado por alguém que partiu<br/>A noite cai de alturas impossíveis<br/>E quebra o silêncio e parte o coração</p>, <p>Há um muro de concreto entre nossos lábios<br/>Há um muro de Berlim dentro de mim<br/>Tudo se divide, todos se separam<br/>(Duas Alemanhas, duas Coreias)<br/>Tudo se divide, todos se separam</p>, <p>Que a chuva caia como uma luva<br/>Um dilúvio, um delírio<br/>Que a chuva traga<br/>Alívio imediato</p>, <p>Que a noite caia<br/>De repente caia<br/>Tão demente quanto um raio<br/>Que a noite traga<br/>Alívio imediato</p>, <p>(Tudo se divide, tudo se separa<br/>Tudo se divide, tudo se separa)</p>, <p>Que a chuva caia como uma luva<br/>Um dilúvio, um delírio<br/>Que a chuva traga<br/>Alívio imediato</p>, <p>Que a noite caia<br/>De repente caia<br/>Tão demente quanto um raio<br/>Que a noite traga<br/>Alívio<br/>Alívio<br/>Alívio<br/>Alívio</p>]"
Terra de Gigantes,"[<p>Ei, mãe!<br/>Eu tenho uma guitarra elétrica<br/>Durante muito tempo isso foi tudo<br/>Que eu queria ter</p>, <p>Mas, ei mãe!<br/>Alguma coisa ficou pra trás<br/>Antigamente eu sabia exatamente o que fazer</p>, <p>Ei, mãe!<br/>Tem uns amigos tocando comigo<br/>Eles são legais, além do mais<br/>Não querem nem saber</p>, <p>Mas agora, lá fora<br/>Todo mundo é uma ilha<br/>A milhas e milhas e milhas<br/>De qualquer lugar</p>, <p>Nessa terra de gigantes<br/>Eu sei, já ouvimos tudo isso antes<br/>A juventude é uma banda<br/>Numa propaganda de refrigerantes</p>, <p>As revistas, as revoltas, as conquistas<br/>Da juventude são heranças<br/>São motivos pras mudanças de atitude<br/>Os discos, as danças, os riscos<br/>Da juventude<br/>A cara limpa, a roupa suja<br/>Esperando que o tempo mude</p>, <p>Nessa terra de gigantes<br/>Tudo isso já foi dito antes<br/>A juventude é uma banda<br/>Numa propaganda de refrigerantes</p>, <p>Ei, mãe!<br/>Já não esquento a cabeça<br/>Durante muito tempo<br/>Isso foi só o que eu podia fazer</p>, <p>Mas ei, ei, mãe!<br/>Por mais que a gente cresça<br/>Há sempre coisas que a gente<br/>Não pode entender</p>, <p>Por isso, mãe<br/>Só me acorda quando o Sol tiver se posto<br/>Eu não quero ver meu rosto<br/>Antes de anoitecer</p>, <p>Pois agora lá fora<br/>O mundo todo é uma ilha<br/>A milhas e milhas e milhas</p>, <p>Nessa terra de gigantes<br/>Que trocam vidas por diamantes<br/>A juventude é uma banda<br/>Numa propaganda de refrigerantes</p>, <p>Nessa terra de gigantes<br/>Que trocam vidas por diamantes<br/>A juventude é uma banda<br/>Numa propaganda de refrigerantes</p>, <p>Ei, mãe<br/>(Ei, mãe)</p>]"
"O Exército de Um Homem Só, I","[<p>Não importa se só tocam<br/>O primeiro acorde da canção<br/>A gente escreve o resto em linhas tortas<br/>Nas portas da percepção<br/>Em paredes de banheiro<br/>Nas folhas que o outono leva ao chão<br/>Em livros de histórias seremos a memória dos dias que virão<br/>Se é que eles virão</p>, <p>Não importa se só tocam<br/>O primeiro verso da canção<br/>A gente escreve o resto sem muita pressa<br/>Com muita precisão<br/>Nos interessa o que não foi impresso<br/>E continua sendo escrito à mão<br/>Escrito à luz de velas quase na escuridão<br/>Longe da multidão</p>, <p>Somos um exército, o exército de um homem só<br/>No difícil exercício de viver em paz<br/>Somos um exército, o exército de um homem só<br/>Sem bandeira<br/>Sem fronteiras<br/>Pra defender<br/>Pra defender</p>, <p>Não importa se só tocam<br/>O primeiro acorde da canção<br/>A gente escreve o resto e o resto é resto<br/>É falsificação<br/>Sangue falso, bangue-bangue italiano<br/>Suíngue falso, turista americano<br/>Livres desta estória, a nossa trajetória não precisa explicação<br/>E não tem explicação</p>, <p>Somos um exército, o exército de um homem só<br/>No difícil exercício de viver em paz<br/>Somos um exército, o exército de um homem só<br/>Sem bandeira<br/>Sem fronteiras<br/>Pra defender<br/>Pra defender</p>, <p>Não interessa o que o bom senso diz<br/>Não interessa o que diz o rei<br/>Se o jogo não há juiz<br/>Não há jogada fora da lei<br/>Não interessa o que diz o ditado<br/>Não interessa o que o Estado diz<br/>Nós falamos outra língua<br/>Moramos em outro país</p>, <p>Somos um exército, o exército de um homem só<br/>No difícil exercício de viver em paz<br/>Nesse exército, o exército de um homem só<br/>Todos sabem<br/>Que tanto faz<br/>Ser culpado<br/>Ou ser capaz<br/>Tanto Faz...</p>]"
Longe Demais Das Capitais,"[<p>Suave é a noite<br/>É a noite que eu saio<br/>Pra conhecer a cidade<br/>E me perder por aí</p>, <p>Nossa cidade é muito grande<br/>E tão pequena<br/>Tão distante do horizonte<br/>Do país</p>, <p>Eu sempre quis viver no velho mundo<br/>Na velha forma de viver<br/>O 3º sexo, a 3ª guerra, o 3º mundo<br/>São tão difíceis de entender</p>, <p>Suave é cidade<br/>Pra quem gosta da cidade<br/>Pra quem tem necessidade de se esconder</p>, <p>Nossa cidade é tão pequena<br/>E tão ingênua<br/>Estamos longe demais<br/>Das capitais</p>, <p>Longe demais das capitais<br/>Longe demais das capitais</p>, <p>Eu sempre quis viver no velho mundo<br/>Na velha forma de viver<br/>O 3º sexo, a 3ª guerra, o 3º mundo<br/>São tão difíceis de entender</p>, <p>O 3º sexo, a 3ª guerra, o 3º mundo</p>]"
Parabólica,"[<p>Ela para e fica ali parada<br/>Olha-se para nada<br/>Paraná<br/>Fica parecida, paraguaia<br/>Para-raios em dia de sol<br/>Para mim</p>, <p>Prenda minha parabólica<br/>Princesinha parabólica<br/>O pecado mora ao lado<br/>E o paraíso paira no ar</p>, <p>Pecados no paraíso</p>, <p>Se a TV estiver fora do ar<br/>Quando passarem<br/>Os melhores momentos da sua vida<br/>Pela janela, alguém estará<br/>De olho em você<br/>Paranoica</p>, <p>Prenda minha parabólica<br/>Princesinha Clarabólica<br/>Paralelas que se cruzam<br/>Em Belém do Pará</p>, <p>Longe, longe, longe aqui do lado<br/>Paradoxo<br/>Nada nos separa</p>, <p>Eu paro e fico aqui parado<br/>Olho-me para longe<br/>A distância não separabólica</p>]"
Herdeiro da Pampa Pobre,"[<p>Mas que pampa é essa que eu recebo agora<br/>Com a missão de cultivar raízes<br/>Se dessa pampa que me fala a história<br/>Não me deixaram nem sequer matizes?</p>, <p>Passam às mãos da minha geração<br/>Heranças feitas de fortunas rotas<br/>Campos desertos que não geram pão<br/>Onde a ganância anda de rédeas soltas</p>, <p>Se for preciso, eu volto a ser caudilho<br/>Por essa pampa que ficou pra trás<br/>Porque eu não quero deixar pro meu filho<br/>A pampa pobre que herdei de meu pai</p>, <p>Que pampa é essa que eu recebo agora<br/>Com a missão de cultivar raízes<br/>Se dessa pampa que me fala a história<br/>Não me deixaram nem sequer matizes?</p>, <p>Passam às mãos da minha geração<br/>Heranças feitas de fortunas rotas<br/>Campos desertos que não geram pão<br/>Onde a ganância anda de rédeas soltas</p>, <p>Se for preciso, eu volto a ser caudilho<br/>Por essa pampa que ficou pra trás<br/>Porque eu não quero deixar pro meu filho<br/>A pampa pobre que herdei de meu pai</p>, <p>Herdei um campo onde o patrão é rei<br/>Tendo poderes sobre o pão e as águas<br/>Onde esquecido vive o peão sem leis<br/>De pés descalços cabresteando mágoas</p>, <p>O que hoje herdo da minha grei chirua<br/>É um desafio que a minha idade afronta<br/>Pois me deixaram com a guaiaca nua<br/>Pra pagar uma porção de contas</p>, <p>Se for preciso, eu volto a ser caudilho<br/>Por essa pampa que ficou pra trás<br/>Porque eu não quero deixar pro meu filho<br/>A pampa pobre que herdei de meu pai</p>, <p>Eu não quero deixar pro meu filho<br/>A pampa pobre que herdei de meu pai</p>, <p>Eu não quero deixar pro meu filho<br/>A pampa pobre que herdei de meu pai</p>]"
